reviewId,userName,userImage,content,score,thumbsUpCount,reviewCreatedVersion,at,replyContent,repliedAt
gp:AOqpTOGEDb22ebj8IayiNr5FhC16Bk7e3Td3L4WiOw-64h7kIz4Uh5o93bO9VxNc_UaBlIE8zzFZnwAoGoN0HA,Joe Stewart,https://lh3.googleusercontent.com/a-/AOh14Gg1UBLuqGRbuT6YCHMXHbxkjwhZHLx6cNOP0Xj7AA,"the app has a massive issue with it where it sends you push notifications, but gives you no place inside the app to actually receive or read them. it's a massive issue when I routinely get ""your order has been delayed until..."" and directs me to the app for the remaining message, which no longer exists anywhere. couple this with unreliable drivers and this makes ordering food an absolute losing craps shoot. I'll be happily no longer using this service given these conditions.",1,61,7.99,10,,
gp:AOqpTOHcBUPrHxjxpB96iTLdD1urzPxWFGtTngL96bL-rya3dscBC3aGk_Roxh8yz8WgUSXn62hbZbbR82rnPA,Nathan Woodford,https://lh3.googleusercontent.com/a-/AOh14Ggq18USCmKaTsYLIqNFXmVUNGbRhAYSFhuspsLteQ,"First delivery went great. Second time I ordered delivery, it said ""pickup"" on my order, and I SPECIFICALLY asked for delivery. I tried to use the help feature, but got NOWHERE. The help feature told me to call the restaurant, which I did, and they told me to use the help feature on the app. It seems the restaurant is refusing to deliver to my house (they delivered last week)and wouldn't refund my money. If you are wondering, I am unable to personally go to the restaurant in question.",1,53,7.99,10,,
gp:AOqpTOGSl0dytIr4wKpcH0t4TqI2bGyxd3xjbtwohlRJUqkJF9N3ceqlDMWN9FYWYJt0xxHmqf9xRQvJcqfpjA,Jodi Lynn Baughman,https://lh3.googleusercontent.com/a-/AOh14GgBiAHfZgzQw4Z1os96z3nmuFRRfDFnr0Iar-et7Q,"I let the app fill in the address, because I did not know the hotel address. The driver delivered to wrong address, refused to work with me. I asked grun hub for a credit, they refused, because the address was wrong. The app filled in the address wrong. This is my only experience with grub hub.",1,12,7.99,09,,
gp:AOqpTOE1zgKRDc7uVsmoIOouDGDDJRs1-0h6b8WresGIGvvfKq90Q_zgDovONVu5U5cBHLSzUHuMp__t03Zkrw,Anthony Kipp,https://lh3.googleusercontent.com/a-/AOh14GjKxHHx3LbBc8q_MCLMKjzbQqjz-n-cihkJWAsG7g,"Such a horrible app. The most inconsistent way to order food. How many times are you guys going to screw up such a simple thing? I've tried to be patient with your app, but the massive inconsistency just makes this garbage unusable. Don't support. Don't install.",1,2,7.98,04,,
gp:AOqpTOHCZEZssj9XqAGJN1SIXnn_77wy_HtAIBgWxIIsw9i1cLMKJNe00BtaebPHOpCLHpFochIpRpFFj6p8Hg,Phynx Rayne,https://lh3.googleusercontent.com/a-/AOh14GhjancouCpO_pB1snhzqf7pr8L1XhAxW48Oo7kYoWY,I've never NOT had an issue with this app. It will glitch and edit my order. Change addresses. Add phone numbers that have been deleted. My last order had items removed but the charge was still there. Definitely switching to Uber Eats.,1,2,7.99,09,,
gp:AOqpTOEJHcGBaepaPPCHubhb_D5lZQSB_IoLCFvdQD6mRP8DwF3VBDLgnKsqi-6fbGahpqWaHMsLfCj2pDyfew,Katie Ketterl,https://lh3.googleusercontent.com/a-/AOh14GgiuYaRVr37H4xT3gzPyqVdD7TyWkNlMGPYqv9ZB6c,"Terrible is an understatement... We had a gift card and I have regrets about even using it. Every single restaurant on their app is ""closed"" so you can order from a total of about 2 restaurants. They said it would be a TWO HOUR wait. So we waited. Then they said it would be ANOTHER HOUR... Then we called the restaurant and no one ever came to pick it up. What the heck??? TERRIBLE service and company model. Won't ever be using this again. That's for sure.",1,6,7.99,10,,
gp:AOqpTOF7dydOW0-lWusxbVeeE1BXIGwpP7UJ2eTsOgAydOSqVfkgfFJtXXSgp2Qjcu8dObLytwcxNfzk6A2cxQ,Auzzy,https://lh3.googleusercontent.com/a-/AOh14GhNPLQVjV4woLAKfthFvNxE6zmnwLJG8Vne1_a0UA,"2nd time downloading it, 2nd time uninstalling it. 1st time was because I order a pizza at a local pizza place. The app didn't tell me I ordered pick up, waited almost an hour for me to figure it out. App was not clear at all about it and I had to call in and cancel the order, thankfully the pizza place is nice and canceled it. 2nd time I ordered from a burger joint here locally that was marked as open! Then i waited 45 mins just to have the driver call me and say they are closed.",1,2,7.98,06,,
gp:AOqpTOETLsf6Xa4ChSI9jlNormWzR_mSO-wD5afHS90yJzRxx8OHDJbB2odTsXXq17eE4hRrEpJxYLKAWMoSyA,Matthew Rivera,https://lh3.googleusercontent.com/-f3FkYQofALo/AAAAAAAAAAI/AAAAAAAAAAA/AMZuuckozSkNp3VXw1fMBUQMIx8VkxD-oQ/photo.jpg,"Bug. Cant even order food as I continually get the ""something went wrong, unknown error"" message. Ridiculous how I haven't been able to use this app even after updating.",1,1,7.99,10,,
gp:AOqpTOHumL5DdPywFRctSu6GM25JTnLGot__irzOFYvvja_oThd80lulNIelpqaHkml4hm6psga9c02kpyPlvA,Matt Greiner,https://lh3.googleusercontent.com/-BF4pSjzL-ZE/AAAAAAAAAAI/AAAAAAAAAAA/AMZuucngOArH6i7fgas-7-qoUIkddjAj7Q/photo.jpg,App frequently only displays last 2 restaurants as open and everything else closed. Only still using it because doordash doesn't work on my phone. Fees/taxes are as much or more than the meal. $33 for a $16 chicken parm. Whoa. Also turns on my location and changes delivery address to 2 houses down automatically. Why make a good app when you make money either way?,1,3,7.98,02,,
gp:AOqpTOEsiG_JbvEkT8odrKFRp2CLsTZzCGkxu_PVRrxFsNXjPCos0OHdLtZJm1WHH43iFpFgdiADcJ8h7SYGbw,Saxy Calzone,https://lh3.googleusercontent.com/a-/AOh14GiKUs57ysM5TIyhzvzCeW87AM-PrTbhtHni9xHzeQ,"Annoying beyond description. Can't have a certain amount of items. Limit of $150, but they include high price steakhouses that are fifty bucks a plate. Useless garbage app",1,1,7.98,07,,
gp:AOqpTOEJUirmwSsuGa8eN_6-yDqXD1mR_Gmj2OCn5cWqL27tGSBfctfVRlKnwdk0b_jCxjqNKy-zyYqpV3RE1g,Christopher Soltys,https://lh3.googleusercontent.com/-k-mq1dvjoYM/AAAAAAAAAAI/AAAAAAAAAAA/AMZuucmUTDl71xJNTinQiueJmRRwghIVmw/photo.jpg,"When I try to search in a geographic area, the map zooms out and gives me restaurants outside of the specified area. Terrible user interface.",1,1,7.98,03,,
gp:AOqpTOEuLrDaTaZChw_WXcPyRh4CkWS-38U9lpYTptLLtCOzMqfUEueRVf0-3qYwVkYbtGAsNaKtU9wEBPHVtQ,Donovan Rummel,https://lh3.googleusercontent.com/a-/AOh14Gggl81SizgkfngkcmyspXZerCxuIVVr9FongNl5kg,"Everytime I use this app I remember why I uninstalled it the previous time last time. Nothing works, keeps overcharging, charges for gh+ when I canceled TWICE",1,0,7.99,10,,
gp:AOqpTOFG-4VPBkUl_dXZB2olBMJZfr3LSf28s0iyMXE2cxkfi4WANve0XH7SXyNi320dgRiQ9HAeek7e4sfYXg,lazyfool109,https://lh3.googleusercontent.com/a-/AOh14Gi_V0HtdD-qmo1g_DWylrPGTD5J4hM2zYmz5ZJx,Looks old and out of date compared to door dash app. Glitchy when trying to add more to bag. App will close then you have find the restaurant you were ordering from again.,1,2,7.98,08,,
gp:AOqpTOFCinvh_ylWqPd7Hf_tNjLfMT5VsqBQAn-KHEM7msg0_Y4U8kIdNXxEhyKXEY0OijWPI39LIM6Tyf3R3A,Fredrick Thomason,https://lh3.googleusercontent.com/a-/AOh14GhFBHO_6x0543d76VMvaQcVghmLdBiiO2_Az-cJOJ0,Could be a lot better in handling resolutions. Trying to handle a mistake made by a restaurant is a headache. Your on hold forever when you call or they put you in a chat list cue waiting for your turn amongst 100-2000 other customers depending on the day.,1,0,7.98,06,,
gp:AOqpTOEommxATPIgqKCh7SjjCMOR3BWISZUdJJHMm1ziY-RQaFMyVU6N0GulcLNskoYyHL9RuzrL2S7EYeSllA,Helping Hands,https://lh3.googleusercontent.com/-k0oL1KBu3sI/AAAAAAAAAAI/AAAAAAAAAAA/AMZuuckVdcGds3Z6EoXMSFvq3nQ-iqJZTw/photo.jpg,"First time using the app. The total including taxes, fees and tip was $35 yet they charged my card $44. No one can tell me what the other $9.00 was for. Will not use this app again.",1,0,7.98,01,,
gp:AOqpTOFati4BQu3gGwnUDON4pE39pFR80Mq6MMk0WTXt8U9iGOQOe4kI6qKqzqSpqnL7Zc_Za7Fwcj9hn73EHQ,Gerardo Reyes,https://lh3.googleusercontent.com/-Ix_M7urptIA/AAAAAAAAAAI/AAAAAAAAAAA/AMZuuck1bDID8SRwFyShGNhc_2fqCBe2yg/photo.jpg,"This app keeps bringing me back to the payment methods screen everytime. I put my venmo, and still ask for payment option. I try PayPal, but it just throws me in circles.",1,0,7.99,07,,
gp:AOqpTOGHyzAjOfDB9ENTtCz2HIt_bHySiB6AW-BXPcimIe22OjZEW9XQxKQHRONdEmzeKCkQoDI7Wf68tVgPVw,Emily Awesum,https://lh3.googleusercontent.com/-B43BGDLoaOM/AAAAAAAAAAI/AAAAAAAAAAA/AMZuucmCrC0O8QzIvvWBTQ1-nfNHv7nEEw/photo.jpg,The idea of the app is great. I've had a specific driver be so very mean to me on multiple occasions. She's just awful. I will not use this app due to fear of her being the one that shows up at my door,1,0,7.98,07,,
gp:AOqpTOEe1TEBCo7ibcDOlsijLvtFuqwCSMW2SVNaPLoa4r8Tux1QzEK3MnSZG6aG-mNx6R1KKhCa3AAjgQseGQ,JohnRB,https://lh3.googleusercontent.com/-CzYTosZpGkc/AAAAAAAAAAI/AAAAAAAAAAA/AMZuuclReM606Yu0lYaT3hX7SXoOYVjVZg/photo.jpg,Unusable. I put my address in and it says It can't find it. Total waste of time.,1,0,7.98,05,,
gp:AOqpTOGJ_VW_z48KkBthbpL6owJO-s-Lwsd81px1rpB0SXjlL08RtoiQMBvmvtV0743IpTmG99Zwcsr7cXr-xw,Michael Gerstner,https://lh3.googleusercontent.com/-wilEGOJfh-4/AAAAAAAAAAI/AAAAAAAAAAA/AMZuuclLvwHe6H4zr2zeKt0si-TQvn4j4A/photo.jpg,Feels like every single input on the app results in being asked to review. Here it is.,1,0,7.98,06,,
gp:AOqpTOH1MBsqeJZwqhwC7FE_AMoVSGuukGJ5VNKOHyPpTYPp4-_-h7UBoTCalvxT4gkcwqPnU0sRfdAdhktKzg,Codie Dreher,https://lh3.googleusercontent.com/-9sovmFJHYsE/AAAAAAAAAAI/AAAAAAAADk4/AMZuuck8h3p9tmfCcrlQ09-KZxtj_RS-9w/photo.jpg,"This app is never reliable. You go in to order, shows everything is open and when you place your order suddenly there are no restaurants available.",1,0,7.98,01,,
gp:AOqpTOFdLRZz0lMuFz2kO02M0eq_cMnOPX44FgOMzTx2Jge3ZkC3GOoGfbKFePCbvQrS4vFe9wZ3R-b62zkXdA,Elijah Basore,https://lh3.googleusercontent.com/a-/AOh14GjBLDrNM3bbU_JqS6hmEiJlY-ucCKoDCmKTM--JVg,"The app will constantly misrepresent delivery times and restaurants will randomly ""close"" causing your order to get cancelled after being delayed several times. Had it happen with my last three orders and can honestly say that literally any other delivery app is better than this right now.",1,2,7.99,09,,
gp:AOqpTOHy2JwX-_zyQIr88Bc6A9hfnqeCgDOTMhCwEy_hfFHQ2VxEepMGl-171y2UGtRufxgIKYaXLzg-J9paGg,June Cheveallier,https://lh3.googleusercontent.com/a-/AOh14GjOf9TtGw2nDx7h0KZbyFXWHTN-JyO0EVuneBYZ9Q,I have a problem with my card number getting stolen twice now since using this app.,1,0,7.99,10,,
gp:AOqpTOHDz0FbmEKgQmyXFqmpNP6fpjPJNwQgivhOsZBMRmk16OOXsYXFb_8ykbciGD3yvcvzv3CCGZEw38AwUQ,Cesar Gomez,https://lh3.googleusercontent.com/-IoA1qqHBnv8/AAAAAAAAAAI/AAAAAAAAAAA/AMZuucnZOIaj0AK2-_nwPZREQYrana5wpw/photo.jpg,Horrible app worst app to get food from get charged for a pretty large meal I ordered for a special event and the moment it should be arriving it says that it got cancelled and that I have to wait 5 business days. Horrible customer service not giving me a reason why it got canceled just blaming it on the restaurant I called the restaurant and they never received the order from the grubhub. 0 star rating if i could. Imma get postmates,1,0,7.98,02,,
gp:AOqpTOGkncjQbr32a_WTmilehQMMpXIT-7kRMbL2nxAMnUZDJOZyK8TpECYcBwFuHGr0lXN4c01-wQm3y4LzaQ,James E,https://lh3.googleusercontent.com/a-/AOh14GhhA3faOuPs9egu_v8C04o8jtAotatizFkg3UeUDw,"Orders are consistently wrong, drivers can't figure out how to get into building despite door code in the instructions. No easy way to get refunds or fixes. App is buggy with numerous random errors. Food delivery estimate is a joke, always arrives 45+ minutes after.",1,0,7.98,06,,
gp:AOqpTOFmsZ6V-K3_O39UVgsNFsztljB7eQaUZu9PPyDnOfersLxvErw5Xhkec_2dKiG1nNdsQfycNpmgvuamqA,Katie Croomes,https://lh3.googleusercontent.com/-dDTF1peiY0Q/AAAAAAAAAAI/AAAAAAAAAAA/AMZuuckKkRvUl6eLU5bcUVydbuJp48MQBw/photo.jpg,This is definitely the most expensive food delivery app and the slowest to bring you food to you door dash is what I would recommend food comes fast and it is much cheaper,1,1,7.98,05,,
gp:AOqpTOF4Vn7RT3Fr-XedNecUnlAZgb3z4pAnchDkVZlc_1YZPAOV7r6OUDgswTT42NCBwGYcrUv28lgxehnNUQ,Logic,https://lh3.googleusercontent.com/a-/AOh14Gj7A4Y9EG_lvrJSj8f-yy5P4Um24BGKQUNIFAJe1yg,Doesn't work I typed in everything exact and have location finder on but the app doesn't show any restaurants,1,1,7.98,03,,
gp:AOqpTOGh3kU9axjZF19bM1mSGaN1hRoj7nTNT0b1gVucqRnAsJZ13vFBS7gtiFwzpDm3a-ieCNraKQYWQEKfcQ,Arryn Dennard,https://lh3.googleusercontent.com/a-/AOh14GidkT03wtEXjwp8NmdbOKx844K7lUzdn7TYPqdsFw,It would be so much improved if there were more transparency in what the delivery cost of a restaurant is. Not knowing until you choose items and go to checkout is unnecessarily circuitous.,1,4,7.98,04,,
gp:AOqpTOFNtevIpWvP8fNoTvJGBjuvcLePAN3N68bfdwyC6NJxYfkLyFtksoaik9nAhaDqCR7OGiWHmwH59SNl1Q,Chris Johnson,https://lh3.googleusercontent.com/a-/AOh14GiU__Sa1MCevqB0ir14mwhMVStu6-ngNnAKI5Hw,"The app is telling me everything is closed, despite restaurants not being closed. This is useless.",1,0,7.99,10,,
gp:AOqpTOE7Le-wQ7xtzaeWVnFCNw0_p5Fm0va6CZKau2Dw_4Sx3mdeiqORIFKx4VkHkm_DbU7xTlIx1P1snNMCAw,Eddy Reif,https://lh3.googleusercontent.com/a-/AOh14GiKaUNbx4oQ5xSAJXhnSmTH_OOwv3ZSc3dRBOiIVg,"App and service is good, but the fees are excessive",1,0,7.99,09,,
gp:AOqpTOGojFtb_MpuRNWlSuhnqkCCmdnsEih1JRZpoW5vBjXNJbyU6GFHExqO0fGKhrPhlhpxC9qdv82ip05BMQ,Daves,https://lh3.googleusercontent.com/-zcJWw_zguaU/AAAAAAAAAAI/AAAAAAAAAAA/AMZuucnQQGVQz_iFSYlYxIHAbn-MEVPiRg/photo.jpg,App is clunky and crashes all the time. I only use it because my favorite restaurant isn't on doordash,1,0,7.98,05,,
gp:AOqpTOFCc_foCMKugkghc5Bd-j_z3nkQJI8C2OZhmrFnNvz4E0ujpuNfwzKqcDRB6wWYKfidgHf-2vBGxdlrjw,Steven Ryan,https://lh3.googleusercontent.com/a-/AOh14GiFzrRX3Wldlgi4JiDIQe8MmTTZhKSb6e3qLPKIOA,"Wasted time!Waited 30mins to have GH cancel my order with no explanation,last time we will ever use GH!",1,0,7.98,04,,
gp:AOqpTOHeg6e1J-p2BBJKWwxFA01iGGsAmmaeqP6n58fOJNciktfa5XzrnVhqhrMPqHKa58Frp0P1XQz8DfKBnQ,Chris Reaves,https://lh3.googleusercontent.com/a-/AOh14GgOpcrIVyN11ruD0m4CjxrunvaaHf_kJWrC4_mE,"The app itself is fine but the service has been a complete disappointment, and definitely not worth the delivery fees. Twice the incorrect order was given to the restaurant, and once the delivery guy was hopelessly behind schedule and didn't bother to tell us until we checked in after our delivery window had closed. After these three strikes, we will not be using it again.",1,1,7.98,03,,
gp:AOqpTOHIYs0Zc93BMbsszv0GW0ModEc7s0h26YblNml0KoHWAtyHo2VusyR2cq-KNGj7JqLck5V3gEbvTbzOOA,Michael Nehls,https://lh3.googleusercontent.com/-FkZPI1GfM2E/AAAAAAAAAAI/AAAAAAAAAAA/AMZuucnuvhPwRi-wLkbLqplH2s4NlN5EXw/photo.jpg,"Only works half the time, drivers are picking up multiple orders. 30+minutes from when it was confirmed picked up.",1,0,7.99,10,,
gp:AOqpTOGnvp9tDQYQ1c9TKREjCnnnMtR1fAAKzy0STKrwNqBtM863wsYSkzZXDzKaba9mQC5T-isIr8annaYO3A,LaKeisha Holmes,https://lh3.googleusercontent.com/-Ctqr9DoHnXM/AAAAAAAAAAI/AAAAAAAAAAA/AMZuucmttTeCQaRIFqn8UwGqEVgxBRnzsQ/photo.jpg,Wont take my debit card ever i always have to use a different one . Their always late.,1,0,7.98,02,,
gp:AOqpTOFFKKbMrByHTJR8NCTcs2QQwyTgTZD8mQw8oo5G31M3WcRw4Q2zjq73aNneEao5cdlEanJXTyioPwNpJw,Kelly LeClain,https://lh3.googleusercontent.com/a-/AOh14GgOUiuG3FVhupXpCYW0py6wwmKyNgPk5Go8RdK-sg,This app never lists my local restaurants. Or when it does I get half through my order and it tells me sorry this restaurant is closed..not worth the time.,1,0,7.98,06,,
gp:AOqpTOGpi7UP0b2dzZzaibN-98vMqOZ4rSv4kNhPN2dkVql8B15RXchYABcZxNvU8nIM5lURkUDBdR7NFudVdQ,Roman Perez,https://lh3.googleusercontent.com/-Sfa5pDdax8M/AAAAAAAAAAI/AAAAAAAAAAA/AMZuuckDA1Jr32q2rVJrVj54-Yni8bm45A/photo.jpg,"Restaurant and drivers dont see the urgency and the importance of delivering something that us as a customer consume. Too many times with this same issues to continue to used this app. Advice for future customers, expect delays and cancellations fees.",1,0,7.98,07,We'll look into this issue for you. Please send us a note at +18775851085 so that we can follow up.,08
gp:AOqpTOGXBGTIc9FJOM8XwWlLlCS5K2F6VIoPjm0fFxHD1wfvXXEPlCx4ccaR6V5qm0KhoGMFELigCd_UNJnKFQ,Marjorie Bates,https://lh3.googleusercontent.com/-53GuRuBaXGc/AAAAAAAAAAI/AAAAAAAAAAA/AMZuucl5N49U12kdScWOfrb_bEFI8He7-A/photo.jpg,"Went to order food for delivery, didnt realize it had swapped to pick up. Have no way of picking up the food. No help sectiom for the order, and when you go to the help section in settings, it miraculously doesn't load anything. So now I can't refund, can't get any help, and can't get the food I wasted money on.",1,0,7.98,04,,
gp:AOqpTOFrbK1P57wO0zLjxGe9LxFD5ebx8LYbp1HgSZ8DouV3XT9g_3X9AuJPAkEus3-TAe9mzkAVnRYXb8pOxw,Dave Waltz,https://lh3.googleusercontent.com/-usafvahXmRE/AAAAAAAAAAI/AAAAAAAAAAA/AMZuucmbSwxnARcWG-3vjVBvxBGkqe9EBA/photo.jpg,"Used to be great. As of the past couple weeks service has went horribly downhill. I i sit and wait for 45mins to 1hr on delivery, fair enough. The problem ive been having is when you wait all that time and then 5mins before your order is supposed to be delivered, they email and say its been delayed a hr or the order has been canceled. The worst is when both happens on 1 transaction. Then they reimburse you like $1 for late orders which doesnt help at all. If the issue a refund, it takes 5 days",1,0,7.98,08,We appreciate this feedback and apologize for any issues.,08
gp:AOqpTOGD4Idij-fRs3J4uAvujbEicHesLXIDbQp8VLbct7jwEKLL68R_gTglsMp6iyIilAfx9aQ_i9HoJJchvA,Stephie Lynn,https://lh3.googleusercontent.com/a-/AOh14GjwlDuTepqz3t4VRgQxasTzECR6jca0W4_SyioV,Terrible service. Have had nothing but issues with the company && their excessive delivery times in the last 4 months. At 1st they were great but their quality has nose dived. App is hella glitchy too. Cinstantly says restaurants are closed when I know they are infact opened.,1,0,7.98,02,,
gp:AOqpTOHPUmHyA9AwrMtmAOH2_8EOG4fCqHYofNYIlJTufd_PV5uiKnl6Wgc_FJKtDegkxoUeQ-UzPtv5OcLuZA,Genesis Andrus,https://lh3.googleusercontent.com/a-/AOh14GgnSrpIgNzfHxg_B0vhRUuhxIkxTYgqCV4ahrvY,"1st time experience and it was just the WORST! waited OVER 2 HOURS just for my order to be canceled! NO expectations, just left me waiting hungry and then canceled.. What a great customer service this app offers.",1,0,7.99,10,,
gp:AOqpTOEiWS8FmcqDHppDOtUneam4LgZBb773NfQPCCufLMwBXGK3koLuE3Wc15t0lXPNTQR5O93f3ARV-0VPFg,payne owens,https://lh3.googleusercontent.com/-PPZSysw5_ts/AAAAAAAAAAI/AAAAAAAAAAA/AMZuucnYacod0CQtMbh6L-FJO6KG0M4Kog/photo.jpg,"Too many cancellations for my liking, last time i use this app",1,0,7.98,02,,
gp:AOqpTOGJ3F6zX4QtsLXvHGnsfWMpovjRJp0GFCYE8ydVoBNKhcgN_ynre0ow2lQCw0L-hePobjXGHRFbGFkrtw,Balcom63,https://lh3.googleusercontent.com/a-/AOh14GjkdGpzKxdBNyD4HGTQcNrCTneYlX8UHajwrN1HkQ,"Even though I know that there are plenty of restaurants that will deliver to me the app says that nothing is available near me. Please fix your app, I would love to stop having to use doordash.[Been over a month guess you guys just don't care]",1,0,7.99,08,,
gp:AOqpTOHImrLxxhpbNl2a9JguGmuNzTJhgyZC7b9q5iNDNXoN8ZN3hHwyllJBajLV0_XUUPrZ4pPjgtGFGvj2Pw,Star Hope,https://lh3.googleusercontent.com/a-/AOh14GhJrZR6VFUWx1atSoTf915lFJh_DW-4nrWUJAamqg,"The app is not the most clear... It gives an ETA delivery time but on the main page says food has been delivered which is confusing. Also, it would be nice if we could view the driver and how far they are when driving so we can accurately calculate their arrival.",1,0,7.91,01,We'll look into this issue for you. Please send us a note at +18775851085 so that we can follow up.,01
gp:AOqpTOEESYnJhtB19AnO-7RJOzueWoYcasaxpRdjDFb6-kc5YyvSIZruNTC--PKYr_W_KcfjvKy45TwYdp2svg,Adam Cockrill,https://lh3.googleusercontent.com/a-/AOh14Gjw3c5PHpX38fIxUwn-176uPSP1-5UAWni2gdK9,"First time using this app ,and I've waited for over an hour, now my order is canceled ,,on their end, and I have to wait 5 days for a refund, not only is this inconvenience frustrating, but I'm still hungry,",1,0,7.98,04,,
gp:AOqpTOHOhYlkGxMeACVGMwmSaQFnz1i5CUh_sM3iT4cXZ5K9lbtklmtMeMa85JPxNMw0fvc8ShBUGzHMThym3Q,J. Case,https://lh3.googleusercontent.com/-jsFKRQZxGCY/AAAAAAAAAAI/AAAAAAAAAAA/AMZuucnn-YHCBNuwQB38WTa2L9gctWWOOQ/photo.jpg,"Without fail, every time, they have to call me to get turn by turn directions to my house. Its extreamly confusing and irritating because if you put the address into google maps it works fine.",1,1,7.96 -- (hotfix/7.96),04,,
gp:AOqpTOG1RDWadypUv0jTt43ENRv4j7pPwSofiNTz2-WGVWHXOkxxz8EvcxQUyKOccAh-4C63VyiIic_SBeB8LQ,Jessy DiPaola,https://lh3.googleusercontent.com/-eSs6uagxsik/AAAAAAAAAAI/AAAAAAAAAAA/AMZuucmZtgvMml-6gbSz8yoRHiUlFrIRcw/photo.jpg,Terrible customer service!! I've tried this app twice and both times it took almost 2 hours to get my order. And you can't contact anyone to cancel or find out why it's taking so long.,1,0,7.98,05,,
gp:AOqpTOHnG7g056ZZxrxDc1xWhhnwh1ELRfxLbkGYNcbc01F19BD_O8YEgq3MDUrAf4fqdqdGtBxdQ7LhauN1pQ,Kenya Green,https://lh3.googleusercontent.com/a-/AOh14GhVewBDMB2nndltkzBkDgTY25d0AUcqQe1hwgPDuw,I had problems with an order so I tried to contact the customer care chat. I was kicked out over 5 times with the reason that I was unresponsive but I never got through to an agent once. This app seen to be made to make it hard to put in a dispute,1,0,7.98,06,,
gp:AOqpTOGUVVZ0iRU33LTGhfywcJMkJ--yIe_ZmKUWXVlJXgbxs92XUNGbc9A2yK_cBk0JC4lyXjvsFWRSY0Ya5w,CJ 276,https://lh3.googleusercontent.com/a-/AOh14Gh6Hv8HG6BCgLcGVBhiD-MKi0FIVfdl8nM5ZbBdeg,I can't order anything I've used about 20 different cards and nothing seems to work all I want is a taco and it won't work,1,0,7.99,08,,
gp:AOqpTOFREnY-n4qytEhhSO3i57_Hfe9jeKQPlgh-KQveTOnLXgNmOol8imZ-BEXSG-ESDoPbdT7W3gLmn6h0GA,amanda lenhart,https://lh3.googleusercontent.com/-cMvUB2-TYUs/AAAAAAAAAAI/AAAAAAAAAAA/AMZuucnUA3Cv60qyghnEikSovdMtqD6yBw/photo.jpg,"I've order 4 times from this app. The first 2 times it took forever to get my food, one was cold and the other was missing food. The last 2 times I never recieved my food and the order had to be cancelled. This app has been horrible and not worth the 20% promo given to make up for mess ups",1,0,7.96 -- (hotfix/7.96),01,,
gp:AOqpTOF2szFQd2f5NL8r8bjoRG5OTylbxm2JvNvpNgrQkOvCs2R0-uQp628hAXsdKjnjUePFqxccnLONDOoeLA,Brian Wieand,https://lh3.googleusercontent.com/a-/AOh14GgFx4Vj7_Be9oc7P7m5iqd-sugEcWgOQCqX86vZmg,Super sketchy that you are not able to edit ur card info in case you want to delete this app and feel secure that you will not get a random charge if you do.,1,0,7.96 -- (hotfix/7.96),03,,
gp:AOqpTOEUTaxdJmbtBIxFjhk0v3dNaQvHT1eM0s4kgBYn9xLjkQDnk7b4_KKvpFtpFTxc79NBCTzpKNS1QdA7HA,Lucas Perin,https://lh3.googleusercontent.com/-mzoYdDaHnTo/AAAAAAAAAAI/AAAAAAAAAAA/AMZuucm1zbi8GOx_tnfj_xb4JqlCv_xaYQ/photo.jpg,"After using the app a few times, I have noticed that more times then not my order is ""lost"" I don't know if this is common for all but it really is a terrible experience",1,0,7.96 -- (hotfix/7.96),01,,
gp:AOqpTOFKhCErKa47FaNurhPbvAsiG-bTrZ90j94MmQc3-7g4RWgsEzuPR3ULcjdhfZfVOqmS6cbyLmirrAk54g,David Johnson,https://lh3.googleusercontent.com/a-/AOh14GhlORK8hLVzoH1ZGbSPj8jjTOs5GZLkvKoivrMehQ,"Doesn't work, ever. Says 'stumbled onto unknown error' every time. For over 6 months. Tech Support hasn't helped. Door dash works fine. Samsung S9",1,3,7.96 -- (hotfix/7.96),01,,
gp:AOqpTOGUnJ46eQV7iW8gUFv-GBm6Na_FZVKUJEhTckq6A-oh9CFQIfV-rvkkZf1hjvC98ukaKj8VDNfvTmXIiw,Jenny Taylor,https://lh3.googleusercontent.com/a-/AOh14GgyWqF8QEoiBeE8a9PwhsTN_aqVYjoSpZcBlB94lhU,"GarbageHub. I've been a user since 2010. They can't seem to prioritize restaurant quality. There are so many restaurants grubhub allows to participate on their platform which have > 4 stars, yet are worse than frozen meals from the grocery store 5 minutes away. I'm tired of playing games with my meals. Goodbye, GrubHub/Seamless/any other branding won't cover up the poor business model.",1,0,7.79,01,,
gp:AOqpTOHJZO3BPmOw7t0vXO5SKH1SLtZivLYQak7OFePqNWWao9Qr9Rvdzz4O4zev1-jhlKTGNNhhhLn0PHWLLg,Felicia Smith,https://lh3.googleusercontent.com/-J1guLFzS7pM/AAAAAAAAAAI/AAAAAAAAAAA/AMZuucm_Zab_XyLfypD9v97ihBY52qnJ-A/photo.jpg,"Horrible experience. The customer service line is atrocious. The app isn't updated to times when restaurants are even open. For my order, the order was placed at 5:30 the app said 40-50 minute wait. I got notified that there was another 30 minute wait. I messaged the driver and he acted like it wasnt his fault when in reality he was supposed to place the order when he got there. He didn't even arrive until 5 minutes before the food was supposed to be delivered.",1,0,7.98,05,,
gp:AOqpTOFvDLRu88ypvhqKfR9SNRHzRkjDWFYshsArnPVtkFe4mblc5x95bhMes0sZS_S31wRUdqQCfx86vugInQ,Tim Polk,https://lh3.googleusercontent.com/-1LwBi_Cdq2E/AAAAAAAAAAI/AAAAAAAAAAA/AMZuucmN1B3c5DhKRQK6QFUtwrobdcbDYA/photo.jpg,Used to be reliable with good customer service. Has gone dramatically down hill.,1,0,7.99,10,"Hi Tim, please accept our sincere apologies. Can you please update the order details here or contact us at +18775851085 so that we can have a look into this right away?",05
gp:AOqpTOHZrvDT24c2XTSlfwrHqlOxYRtVX6a_IBXz0GT3rlb35q0zDqY18ErV73jGbzGSiw64WMEEErdlMSvRqQ,Kristy Kiefer,https://lh3.googleusercontent.com/-lW17b-RJRsM/AAAAAAAAAAI/AAAAAAAAAAA/AMZuucngY1GNkgaNiH7AsOaSYNaBPiizNQ/photo.jpg,Aweful. Over priced. Was not clear with I was ordering. Over charging in quarantine. Such bs.,1,0,7.98,02,,
gp:AOqpTOEb0Nm1slaj8m3r_sTIVWifoVcWf2mt9KKlcfUEExCmudL3-aHD-VBc3BDorHdY7JEH54LZGUwdAtnHGw,Hayley Mckittrick,https://lh3.googleusercontent.com/-O-CjUxtOJAc/AAAAAAAAAAI/AAAAAAAAAAA/AMZuucn-lKFfgiABFAyjQh6qQyXrJkxE1w/photo.jpg,It wont let me add extra meat or anything the options are limited. Its better just going in and picking it up,1,0,7.98,04,,
